relation,description,title
P50,"author main creator(s) of a written work (use on works, not humans); use P2093 when Wikidata item is unknown or does not exist written by writer writers authors author(s) writer(s) by creator",author
P1366,"replaced by other person or item which continues the item by replacing it in its role. Use P156 (followed by) if the item is not replaced (e.g. books in a series), nor identical, but adds to the series without dropping the role of this item in that series heir next job holder successor succeeded by superseded by continued by mediatised to",replaced by
P1365,"replaces person, state or item replaced. Use ""structure replaces"" (P1398) for structures. Use ""follows"" (P155) if the previous item was not replaced or predecessor and successor are identical forefather previous job holder replaced preceded by succeeds predecessor supersedes continues from continues deprecates",replaces
P937,"work location location where persons or organisations were actively participating in employment, business or other work workplace work location place of activity active in location of work place of work working at work place work residence place of employment work area conducts business at conducts business in",work location
P140,"religion religion of a person, organization or religious building, or associated with this subject religious affiliation faith life stance denomination follower of religion follows religion has religion",religion
P69,educated at educational institution attended by subject alma mater education alumni of alumna of college attended university attended school attended studied at graduate of graduated from faculty place of education alumnus of attended went to school at schooled at attended school at schooling place education place,educated at
P1198,unemployment rate portion of a workforce population that is not employed ,unemployment rate
P1056,"product or material produced material or product produced by a government agency, business, industry, facility, or process material produced produces manufactures makes has product product maker of manufacturer of producer of results in creates output products work produced commodity they make",product or material produced
